{
  "avisos": [],
  "estado_aprobacion": "borrador",
  "filas": [
    {
      "atributos": {},
      "clave": "activo",
      "decision": "incluido",
      "declarado": null,
      "estado_aprobacion": "borrador",
      "fuente": "scope/alcance.md §4",
      "huella_fuente": "4af6a2ba931183e82b90661ebb909f1786e3f6440fc9042904b5c1c6ba175536",
      "id": "A-ea4a7a8240",
      "insumo_cambio": false,
      "marca_legal": null,
      "motivo": "",
      "observacion": "",
      "orden": 1,
      "tipo": "activo",
      "valor": "Metasploitable2 (tipo: host; rol: objetivo del laboratorio inicial)"
    },
    {
      "atributos": {},
      "clave": "organizacion",
      "decision": "incluido",
      "declarado": null,
      "estado_aprobacion": "borrador",
      "fuente": "scope/autorizacion.md §1",
      "huella_fuente": "8cb864b376dee28541c949941161609f896bd3ed57a0e485f8d59cbb26692577",
      "id": "A-dcfd37ef23",
      "insumo_cambio": false,
      "marca_legal": null,
      "motivo": "",
      "observacion": "Consta en la autorización; la firma del representante es aparte.",
      "orden": 2,
      "tipo": "parte",
      "valor": "Comercial Andes Sur SpA (cliente del informe de cierre según PROMPT_SPEC_KIT.md; ejercicio de laboratorio)"
    },
    {
      "atributos": {
        "cobertura": "12 de 93 controles del Anexo A en el catálogo de la herramienta",
        "estado_herramienta": "implementado parcialmente",
        "version": "2022",
        "version_referencia": "2022"
      },
      "clave": "iso-27001",
      "decision": "incluido",
      "declarado": null,
      "estado_aprobacion": "borrador",
      "fuente": "scope/alcance.md §3",
      "huella_fuente": "9d773b9b33f63b056c08479b4236efebfc9ce2b1a991df6ea3f2e9b72ef5e9c5",
      "id": "A-de7ee6f434",
      "insumo_cambio": false,
      "marca_legal": null,
      "motivo": "",
      "observacion": "",
      "orden": 3,
      "tipo": "marco",
      "valor": "ISO/IEC 27001:2022"
    },
    {
      "atributos": {
        "cobertura": "el catálogo trae las seis funciones, sin categorías ni subcategorías",
        "estado_herramienta": "mencionado",
        "version": "2.0",
        "version_referencia": "2.0"
      },
      "clave": "nist-csf",
      "decision": "pendiente de confirmar",
      "declarado": null,
      "estado_aprobacion": "borrador",
      "fuente": ".specify/memory/constitution.md §IV",
      "huella_fuente": null,
      "id": "A-9d8d89c595",
      "insumo_cambio": false,
      "marca_legal": null,
      "motivo": "",
      "observacion": "Marco de referencia de la constitución; no está declarado en el alcance.",
      "orden": 4,
      "tipo": "marco",
      "valor": "NIST CSF 2.0"
    },
    {
      "atributos": {
        "cobertura": "sin catálogo en la herramienta",
        "estado_herramienta": "mencionado",
        "version": "v8.1",
        "version_referencia": "v8.1"
      },
      "clave": "cis-controls",
      "decision": "pendiente de confirmar",
      "declarado": null,
      "estado_aprobacion": "borrador",
      "fuente": ".specify/memory/constitution.md §IV",
      "huella_fuente": null,
      "id": "A-3aa198f837",
      "insumo_cambio": false,
      "marca_legal": null,
      "motivo": "",
      "observacion": "Marco de referencia de la constitución; no está declarado en el alcance.",
      "orden": 5,
      "tipo": "marco",
      "valor": "CIS Controls v8.1"
    },
    {
      "atributos": {
        "antecedente": "Exigible. ANCI operativa; IG N°2/3/4 y DS 295/2024 vigentes (anotado en scope/alcance.md §3, columna «Estado (sep-2026)»)",
        "articulo": null,
        "fecha_consulta": null,
        "fuente_oficial": null,
        "fundamento": null
      },
      "clave": "ley-21.663",
      "decision": "incluido",
      "declarado": null,
      "estado_aprobacion": "borrador",
      "fuente": "scope/alcance.md §3",
      "huella_fuente": "9d773b9b33f63b056c08479b4236efebfc9ce2b1a991df6ea3f2e9b72ef5e9c5",
      "id": "A-0e8b027570",
      "insumo_cambio": false,
      "marca_legal": "VALIDAR",
      "motivo": "",
      "observacion": "Obligación candidata. Falta: fuente oficial, fecha de consulta, artículo, fundamento de aplicabilidad. La aplicabilidad depende de la clasificación OIV / servicio esencial, que no consta (scope/alcance.md §9).",
      "orden": 6,
      "tipo": "obligacion",
      "valor": "Ley 21.663 + ANCI: Gestión de incidentes, medidas mínimas, reporte a CSIRT/ANCI (3 h alerta temprana, 72 h reporte), delegado de ciberseguridad (si aplica OIV)"
    },
    {
      "atributos": {
        "antecedente": "Preparación. Vigencia 01-dic-2026 con proyecto de postergación a 01-dic-2027 (verificar al inicio del encargo) (anotado en scope/alcance.md §3, columna «Estado (sep-2026)»)",
        "articulo": null,
        "fecha_consulta": null,
        "fuente_oficial": null,
        "fundamento": null
      },
      "clave": "ley-21.719",
      "decision": "incluido",
      "declarado": null,
      "estado_aprobacion": "borrador",
      "fuente": "scope/alcance.md §3",
      "huella_fuente": "9d773b9b33f63b056c08479b4236efebfc9ce2b1a991df6ea3f2e9b72ef5e9c5",
      "id": "A-a3251ac311",
      "insumo_cambio": false,
      "marca_legal": "VALIDAR",
      "motivo": "",
      "observacion": "Obligación candidata. Falta: fuente oficial, fecha de consulta, artículo, fundamento de aplicabilidad.",
      "orden": 7,
      "tipo": "obligacion",
      "valor": "Ley 21.719: Bases de licitud, derechos ARCO+, datos sensibles, seguridad del tratamiento, DPO, transferencias internacionales"
    },
    {
      "atributos": {
        "antecedente": "Vigente. Fundamenta la exigencia de autorización (anotado en scope/alcance.md §3, columna «Estado (sep-2026)»)",
        "articulo": null,
        "fecha_consulta": null,
        "fuente_oficial": null,
        "fundamento": null
      },
      "clave": "ley-21.459",
      "decision": "excluido",
      "declarado": null,
      "estado_aprobacion": "borrador",
      "fuente": "scope/alcance.md §3",
      "huella_fuente": "9d773b9b33f63b056c08479b4236efebfc9ce2b1a991df6ea3f2e9b72ef5e9c5",
      "id": "A-641a360a94",
      "insumo_cambio": false,
      "marca_legal": "VALIDAR",
      "motivo": "No se audita: delimita lo legalmente permitido durante las pruebas",
      "observacion": "Obligación candidata. Falta: fuente oficial, fecha de consulta, artículo, fundamento de aplicabilidad.",
      "orden": 8,
      "tipo": "obligacion",
      "valor": "Ley 21.459 (delitos informáticos): No se audita: delimita lo legalmente permitido durante las pruebas"
    },
    {
      "atributos": {},
      "clave": "tecnico:1:superficie-de-red-y-servicios-expuestos",
      "decision": "pendiente de confirmar",
      "declarado": "incluido",
      "estado_aprobacion": "borrador",
      "fuente": "scope/alcance.md §4",
      "huella_fuente": "4af6a2ba931183e82b90661ebb909f1786e3f6440fc9042904b5c1c6ba175536",
      "id": "A-7f614b0027",
      "insumo_cambio": false,
      "marca_legal": null,
      "motivo": "",
      "observacion": "Declarado incluido, sin motivo en el ítem.",
      "orden": 9,
      "tipo": "dominio",
      "valor": "Superficie de red y servicios expuestos (puertos, versiones, banners)"
    },
    {
      "atributos": {},
      "clave": "tecnico:2:vulnerabilidades-conocidas-cve-y-configu",
      "decision": "pendiente de confirmar",
      "declarado": "incluido",
      "estado_aprobacion": "borrador",
      "fuente": "scope/alcance.md §4",
      "huella_fuente": "4af6a2ba931183e82b90661ebb909f1786e3f6440fc9042904b5c1c6ba175536",
      "id": "A-ca09b441f3",
      "insumo_cambio": false,
      "marca_legal": null,
      "motivo": "",
      "observacion": "Declarado incluido, sin motivo en el ítem.",
      "orden": 10,
      "tipo": "dominio",
      "valor": "Vulnerabilidades conocidas (CVE) y configuraciones inseguras"
    },
    {
      "atributos": {},
      "clave": "tecnico:3:autenticacion-credenciales-por-defecto-y",
      "decision": "pendiente de confirmar",
      "declarado": "incluido",
      "estado_aprobacion": "borrador",
      "fuente": "scope/alcance.md §4",
      "huella_fuente": "4af6a2ba931183e82b90661ebb909f1786e3f6440fc9042904b5c1c6ba175536",
      "id": "A-f1a1774093",
      "insumo_cambio": false,
      "marca_legal": null,
      "motivo": "",
      "observacion": "Declarado incluido, sin motivo en el ítem.",
      "orden": 11,
      "tipo": "dominio",
      "valor": "Autenticación, credenciales por defecto y débiles"
    },
    {
      "atributos": {},
      "clave": "tecnico:4:cifrado-en-transito-tls-ssh-y-exposicion",
      "decision": "pendiente de confirmar",
      "declarado": "incluido",
      "estado_aprobacion": "borrador",
      "fuente": "scope/alcance.md §4",
      "huella_fuente": "4af6a2ba931183e82b90661ebb909f1786e3f6440fc9042904b5c1c6ba175536",
      "id": "A-ad0247cfde",
      "insumo_cambio": false,
      "marca_legal": null,
      "motivo": "",
      "observacion": "Declarado incluido, sin motivo en el ítem.",
      "orden": 12,
      "tipo": "dominio",
      "valor": "Cifrado en tránsito (TLS/SSH) y exposición de datos"
    },
    {
      "atributos": {},
      "clave": "tecnico:5:validacion-controlada-de-explotabilidad",
      "decision": "pendiente de confirmar",
      "declarado": "incluido",
      "estado_aprobacion": "borrador",
      "fuente": "scope/alcance.md §4",
      "huella_fuente": "4af6a2ba931183e82b90661ebb909f1786e3f6440fc9042904b5c1c6ba175536",
      "id": "A-0aea6c19e2",
      "insumo_cambio": false,
      "marca_legal": null,
      "motivo": "",
      "observacion": "Declarado incluido, sin motivo en el ítem.",
      "orden": 13,
      "tipo": "dominio",
      "valor": "Validación controlada de explotabilidad (solo prueba de concepto, no disrupción)"
    },
    {
      "atributos": {},
      "clave": "control:1:tecnologicos-a-8-gestion-de-vulnerabilid",
      "decision": "pendiente de confirmar",
      "declarado": "incluido",